name,line,end,kind,signature,intent,consumers,consumer_count,exposed_to_dom,refs,status
"ensureAddedTasksContextLoaded",3624,3665,sync,"","Teacher: load/switch the added-tasks context for the current student+filter, rebuilding id counts.","getCurrentTeacherPickSessionSeed|setCurrentTeacherPickSessionSeed|onTeacherContextChanged|syncAddedTasksToSelection|openAddedTasksModal|openAddedTasksModalFast|initAddedTasksModal",7,no,8,called
"getCurrentTeacherPickSessionSeed",3666,3672,sync,"studentId = null","Teacher: get the current added-tasks context seed for a student (empty if none).","loadTeacherStudentStats|pickQuestionsViaTeacherScreenResolve|pickQuestionsViaTeacherScreenResolveBatch",3,no,4,called
"setCurrentTeacherPickSessionSeed",3673,3681,sync,"seed","Teacher: set the current context seed (defaulting to a new seed) and persist.","loadTeacherStudentStats|rotateCurrentTeacherPickSessionSeed|pickQuestionsViaTeacherScreenResolve|pickQuestionsViaTeacherScreenResolveBatch",4,no,5,called
"rotateCurrentTeacherPickSessionSeed",3682,3685,sync,"","Teacher: replace the current context seed with a fresh random one.","bulkResetAll",1,no,2,called
"onTeacherContextChanged",3686,3697,sync,"opts = {}","Teacher: on student/filter change reload context, force-sync added tasks, refresh proto badges.","initTeacherPickFiltersUI|setTeacherStudentViewUI",2,no,4,called
"scheduleSyncAddedTasks",3698,3708,sync,"opts = {}","Teacher: debounce (or immediate) a sync of added-task buckets to the current selection.","refreshCountsUI|setTopicCount|setSectionCount|setProtoCount|onTeacherContextChanged|initAddedTasksModal",6,no,7,called
"flushTeacherAddedTasksSelection",3709,3717,async,"reason = 'flush'","Teacher: cancel pending debounce and synchronously sync added tasks (before navigation/save).","initCreateHomeworkButton|openAddedTasksModalFast|saveSelectionAndGo",3,no,4,called
"incIdCount",3718,3725,sync,"id","Teacher: increment the in-context usage count for a question id (dedup/exclude tracking).","appendPickedQuestionsToBucket|syncAddedTasksToSelection",2,no,3,called
"decIdCount",3726,3735,sync,"id","Teacher: decrement (and drop at zero) the in-context usage count for a question id.","syncAddedTasksToSelection",1,no,2,called
"getExcludeSet",3736,3743,sync,"","Teacher: build the set of already-added question ids to exclude from new picks.","pickDeltaForBucket|syncAddedTasksToSelection",2,no,7,called
"getDesiredCountsFromSelection",3744,3762,sync,"","Teacher: convert CHOICE_* maps into desired per-bucket counts (proto/topic/section) and total.","syncAddedTasksToSelection",1,no,2,called
"flattenAddedQuestions",3763,3772,sync,"","Teacher: flatten all added-task buckets into a single questions array.","collectTeacherPickedRefs|syncAddedTasksToSelection|openAddedTasksModal|openAddedTasksModalFast",4,no,7,called
"sortAddedQuestions",3773,3791,sync,"arr","Teacher: sort added questions by section, then topic, then question id.","collectTeacherPickedRefs|syncAddedTasksToSelection|openAddedTasksModal|openAddedTasksModalFast",4,no,7,called
"buildTeacherResolveSelection",3792,3805,sync,"{ excludeTopicIds = [] } = {}","Teacher: build the RPC selection payload (protos/topics/sections + excluded topics).","pickQuestionsViaTeacherScreenResolve|pickQuestionsViaTeacherScreenResolveBatch",2,no,3,called
"pickQuestionsViaTeacherScreenResolve",3806,3877,async,"{ request = {}, excludeTopicIds = [], excludeQuestionIds = [], } = {}","Teacher: resolve concrete questions for one scope via teacher_picking_screen_v2 (resolve mode).","pickDeltaForBucket|syncAddedTasksToSelection",2,no,6,called
"pickQuestionsViaTeacherScreenResolveBatch",3878,3971,async,"{ requests = [], excludeTopicIds = [], excludeQuestionIds = [], } = {}","Teacher: resolve concrete questions for many scopes in one teacher_picking_resolve_batch_v1 call.","syncAddedTasksToSelection",1,no,4,called
"pickDeltaForBucket",3972,4089,async,"bucketKey, delta, seq","Teacher: pick N more questions for a bucket — via RPC when a student is selected, else local engine.","syncAddedTasksToSelection",1,no,5,called
"appendPickedQuestionsToBucket",4090,4104,sync,"ctx, bucketKey, questions = []","Teacher: append picked questions to a bucket and bump id counts; returns how many added.","syncAddedTasksToSelection",1,no,10,called
"syncAddedTasksToSelection",4105,4370,async,"opts = {}","Teacher: reconcile added-task buckets with the selection (trim, top up protos/topics/sections).","scheduleSyncAddedTasks|flushTeacherAddedTasksSelection|openAddedTasksModal",3,no,4,called
"openAddedTasksModal",4371,4402,async,"","Teacher: open added-tasks modal — sync selection then render the preview (full path).","",0,no,1,DEAD-CANDIDATE
"closeAddedTasksModal",4403,4410,sync,"","Teacher: close the added-tasks preview modal.","initAddedTasksModal",1,yes,4,called
"openAddedTasksModalFast",4411,4458,async,"","Teacher: open added-tasks modal reusing the rendered view when unchanged, else flush+render.","initAddedTasksModal",1,no,2,called
"initAddedTasksModal",4459,4486,sync,"","Teacher: one-time wiring of the added-tasks button/close/backdrop/Escape + initial context load.","initAuthHeader",1,no,2,called
"loadTopicPoolForPreview",4487,4550,async,"topic","Util: load+memoize a topic's full prototype pool from its manifest(s) (topic.path/paths).","warmTeacherModalStatsForStudent",1,no,7,called
"buildQuestionForPreview",4551,4576,sync,"manifest, type, proto","Util: build a preview question (ids, titles, stem, figure, badge ids) from manifest/type/proto.","buildPreviewQuestionsFromResolveRows",1,no,7,called
"normalizeResolveReqArray",4577,4597,sync,"source","Util: normalize a choice map/array into [{id,n}] entries with positive n.","buildTeacherResolveSelection",1,no,4,called
"buildResolveBucketKey",4598,4607,sync,"scopeKind, scopeId","Util: build a canonical 'proto:/topic:/section:' bucket key from a scope kind+id.","pickQuestionsViaTeacherScreenResolveBatch|getResolveRowBucketKey",2,no,3,called
"getResolveRowBucketKey",4608,4629,sync,"row","Util: derive the bucket key for a resolved RPC row (handles global_all and id aliases).","buildPreviewQuestionsFromResolveRows",1,no,2,called
"getTeacherResolveManifestIndex",4630,4666,async,"manifestPath","Teacher: fetch+cache a manifest and build a question-id -> {manifest,type,proto} index.","buildPreviewQuestionsFromResolveRows",1,no,2,called
"buildPreviewQuestionsFromResolveRows",4667,4760,async,"{ rows, wantsByBucket, excludeQuestionIds = [], } = {}","Teacher: turn resolved RPC rows into preview questions per bucket, dedup up to wanted counts.","pickQuestionsViaTeacherScreenResolve|pickQuestionsViaTeacherScreenResolveBatch",2,no,3,called
"getAddedTasksRenderSignature",4761,4772,sync,"questions = [], opts = {}","Teacher: compute a signature of the added-tasks list (context+total+ordered ids) for reuse.","openAddedTasksModal|openAddedTasksModalFast|renderAddedTasksPreview",3,no,4,called
"hydrateAddedTasksModalBadgesFromCache",4773,4813,sync,"questions = []","Teacher: fill added-task card badges from cached aggregates without a network call.","openAddedTasksModalFast",1,no,2,called
"refreshAddedTasksModalBadges",4814,4877,async,"questions = []","Teacher: fetch and render per-card student stat/date badges in the added-tasks modal.","refreshAddedTasksModalView",1,no,2,called
"refreshAddedTasksModalView",4878,4884,async,"questions, opts = {}","Teacher: render the added-tasks preview, typeset math, then refresh badges.","syncAddedTasksToSelection|openAddedTasksModal|openAddedTasksModalFast",3,no,4,called
"renderAddedTasksPreview",4885,4994,sync,"questions, opts = {}","Teacher: render added-task cards (numbering, badges, section/topic meta, stem, figure) + meta.","refreshAddedTasksModalView",1,no,2,called
"saveSelectionAndGo",4995,5110,async,"","Both: finalize selection, build frozen questions, create a session link, navigate to trainer/list.","initAuthHeader",1,no,5,called
"esc",5111,5119,sync,"s","Util: HTML-escape a string (ampersand/lt/gt/quote).","renderSectionNode|renderTopicRow",2,no,3,called
"compareId",5120,5131,sync,"a, b","Util: numeric dotted-id comparator (e.g. '1.2' < '1.10') for sorting.","loadCatalog|openProtoPickerModal|sortAddedQuestions|syncAddedTasksToSelection|buildPreviewQuestionsFromResolveRows",5,no,10,called
